{
  "schema": "org.mura.flash.procedure-registry/v1",
  "valueTypes": [
    "artifact-ref",
    "backup-ref",
    "boolean",
    "bytes",
    "device-ref",
    "digest",
    "duration-ms",
    "integer",
    "mode",
    "partition-ref",
    "path",
    "property-name",
    "state-ref",
    "string",
    "string-list",
    "uri",
    "verified-artifact-ref"
  ],
  "safetyClasses": [
    "host-read",
    "host-transform",
    "device-read",
    "device-transition",
    "device-code-execution",
    "device-write",
    "device-erase",
    "security-state-change",
    "manual"
  ],
  "operations": [
    {
      "id": "artifact.fetch",
      "safetyClass": "host-read",
      "inputs": [
        {
          "name": "sourceUri",
          "type": "uri",
          "required": true
        },
        {
          "name": "destination",
          "type": "path",
          "required": true
        }
      ],
      "outputs": [
        {
          "name": "artifact",
          "type": "artifact-ref",
          "required": true
        }
      ],
      "stateEffect": "host-artifacts",
      "failureClasses": [
        "artifact-fetch-failed",
        "operation-timeout"
      ],
      "requiredAdapterCapability": "artifact.fetch",
      "algorithmParameters": [
        {
          "name": "redirect-policy",
          "value": "same-scheme-or-https"
        },
        {
          "name": "partial-file-policy",
          "value": "discard"
        }
      ],
      "sourceCitations": [
        {
          "kind": "pinned-external",
          "uri": "https://github.com/mura-os/mura/blob/48699362710177854ebeedb7c25f30277296d401/docs/research/72-xr-unlock-and-flash-targets.md",
          "commit": "48699362710177854ebeedb7c25f30277296d401",
          "path": "docs/research/72-xr-unlock-and-flash-targets.md",
          "lineStart": 510,
          "lineEnd": 518
        }
      ]
    },
    {
      "id": "artifact.verify",
      "safetyClass": "host-read",
      "inputs": [
        {
          "name": "artifact",
          "type": "artifact-ref",
          "required": true
        },
        {
          "name": "expectedDigest",
          "type": "digest",
          "required": true
        }
      ],
      "outputs": [
        {
          "name": "verifiedArtifact",
          "type": "artifact-ref",
          "required": true
        },
        {
          "name": "actualDigest",
          "type": "digest",
          "required": true
        }
      ],
      "stateEffect": "host-artifacts",
      "failureClasses": [
        "artifact-verification-failed",
        "hash-mismatch"
      ],
      "requiredAdapterCapability": "artifact.sha256",
      "algorithmParameters": [
        {
          "name": "digest-algorithm",
          "value": "sha256"
        },
        {
          "name": "comparison",
          "value": "constant-time-lowercase-hex"
        }
      ],
      "sourceCitations": [
        {
          "kind": "pinned-external",
          "uri": "https://github.com/mura-os/mura/blob/48699362710177854ebeedb7c25f30277296d401/docs/research/72-xr-unlock-and-flash-targets.md",
          "commit": "48699362710177854ebeedb7c25f30277296d401",
          "path": "docs/research/72-xr-unlock-and-flash-targets.md",
          "lineStart": 510,
          "lineEnd": 518
        }
      ]
    },
    {
      "id": "artifact.extract",
      "safetyClass": "host-transform",
      "inputs": [
        {
          "name": "verifiedArtifact",
          "type": "artifact-ref",
          "required": true
        },
        {
          "name": "destination",
          "type": "path",
          "required": true
        }
      ],
      "outputs": [
        {
          "name": "members",
          "type": "string-list",
          "required": true
        }
      ],
      "stateEffect": "host-artifacts",
      "failureClasses": [
        "artifact-extraction-failed"
      ],
      "requiredAdapterCapability": "artifact.extract",
      "algorithmParameters": [
        {
          "name": "path-traversal",
          "value": "reject"
        },
        {
          "name": "symlinks",
          "value": "reject"
        }
      ],
      "sourceCitations": [
        {
          "kind": "pinned-external",
          "uri": "https://github.com/mura-os/mura/blob/48699362710177854ebeedb7c25f30277296d401/docs/research/72-xr-unlock-and-flash-targets.md",
          "commit": "48699362710177854ebeedb7c25f30277296d401",
          "path": "docs/research/72-xr-unlock-and-flash-targets.md",
          "lineStart": 544,
          "lineEnd": 554
        }
      ]
    },
    {
      "id": "adb.property",
      "safetyClass": "device-read",
      "inputs": [
        {
          "name": "device",
          "type": "device-ref",
          "required": true
        },
        {
          "name": "property",
          "type": "property-name",
          "required": true
        }
      ],
      "outputs": [
        {
          "name": "value",
          "type": "string",
          "required": true
        }
      ],
      "stateEffect": "none",
      "failureClasses": [
        "transport-failed",
        "device-disconnected",
        "operation-timeout"
      ],
      "requiredAdapterCapability": "adb.get-property",
      "algorithmParameters": [
        {
          "name": "shell-template",
          "value": "getprop-single-name"
        },
        {
          "name": "arbitrary-command",
          "value": false
        }
      ],
      "sourceCitations": [
        {
          "kind": "pinned-external",
          "uri": "https://github.com/mura-os/mura/blob/48699362710177854ebeedb7c25f30277296d401/docs/research/72-xr-unlock-and-flash-targets.md",
          "commit": "48699362710177854ebeedb7c25f30277296d401",
          "path": "docs/research/72-xr-unlock-and-flash-targets.md",
          "lineStart": 59,
          "lineEnd": 75
        }
      ]
    },
    {
      "id": "adb.push",
      "safetyClass": "device-write",
      "inputs": [
        {
          "name": "device",
          "type": "device-ref",
          "required": true
        },
        {
          "name": "artifact",
          "type": "artifact-ref",
          "required": true
        },
        {
          "name": "remotePath",
          "type": "path",
          "required": true
        }
      ],
      "outputs": [
        {
          "name": "bytesWritten",
          "type": "integer",
          "required": true
        }
      ],
      "stateEffect": "device-storage",
      "failureClasses": [
        "transport-failed",
        "device-disconnected",
        "write-failed"
      ],
      "requiredAdapterCapability": "adb.push",
      "algorithmParameters": [
        {
          "name": "overwrite-policy",
          "value": "procedure-declared-path-only"
        }
      ],
      "sourceCitations": [
        {
          "kind": "pinned-external",
          "uri": "https://github.com/mura-os/mura/blob/48699362710177854ebeedb7c25f30277296d401/docs/research/72-xr-unlock-and-flash-targets.md",
          "commit": "48699362710177854ebeedb7c25f30277296d401",
          "path": "docs/research/72-xr-unlock-and-flash-targets.md",
          "lineStart": 50,
          "lineEnd": 57
        }
      ]
    },
    {
      "id": "adb.pull",
      "safetyClass": "device-read",
      "inputs": [
        {
          "name": "device",
          "type": "device-ref",
          "required": true
        },
        {
          "name": "remotePath",
          "type": "path",
          "required": true
        },
        {
          "name": "destination",
          "type": "path",
          "required": true
        }
      ],
      "outputs": [
        {
          "name": "artifact",
          "type": "artifact-ref",
          "required": true
        }
      ],
      "stateEffect": "host-artifacts",
      "failureClasses": [
        "transport-failed",
        "device-disconnected",
        "backup-failed"
      ],
      "requiredAdapterCapability": "adb.pull",
      "algorithmParameters": [
        {
          "name": "source-policy",
          "value": "procedure-declared-path-only"
        }
      ],
      "sourceCitations": [
        {
          "kind": "pinned-external",
          "uri": "https://github.com/mura-os/mura/blob/48699362710177854ebeedb7c25f30277296d401/docs/research/72-xr-unlock-and-flash-targets.md",
          "commit": "48699362710177854ebeedb7c25f30277296d401",
          "path": "docs/research/72-xr-unlock-and-flash-targets.md",
          "lineStart": 157,
          "lineEnd": 164
        }
      ]
    },
    {
      "id": "adb.sideload",
      "safetyClass": "device-write",
      "inputs": [
        {
          "name": "device",
          "type": "device-ref",
          "required": true
        },
        {
          "name": "verifiedArtifact",
          "type": "artifact-ref",
          "required": true
        }
      ],
      "outputs": [
        {
          "name": "result",
          "type": "string",
          "required": true
        }
      ],
      "stateEffect": "device-storage",
      "failureClasses": [
        "transport-failed",
        "device-rejected",
        "write-failed"
      ],
      "requiredAdapterCapability": "adb.sideload",
      "algorithmParameters": [
        {
          "name": "accepted-mode",
          "value": "recovery-sideload"
        }
      ],
      "sourceCitations": [
        {
          "kind": "pinned-external",
          "uri": "https://github.com/mura-os/mura/blob/48699362710177854ebeedb7c25f30277296d401/docs/research/72-xr-unlock-and-flash-targets.md",
          "commit": "48699362710177854ebeedb7c25f30277296d401",
          "path": "docs/research/72-xr-unlock-and-flash-targets.md",
          "lineStart": 470,
          "lineEnd": 479
        }
      ]
    },
    {
      "id": "adb.reboot",
      "safetyClass": "device-transition",
      "inputs": [
        {
          "name": "device",
          "type": "device-ref",
          "required": true
        },
        {